{
  "schema_version": 1,
  "deck_id": "sample",
  "generated_at": "2026-09-27T00:00:00Z",
  "sample": true,
  "speakers": {},
  "shows": {
    "402p": {
      "name": "4.0 to Pro"
    }
  },
  "episodes": {},
  "principles": [
    {
      "id": "p-two-backhands-middle",
      "schema_version": 1,
      "sample": true,
      "status": "active",
      "category": "strategy",
      "topic": "targets",
      "format": "doubles",
      "levels": [
        "4.0",
        "4.5"
      ],
      "statement": "When their two backhands meet in the middle, the middle is your target.",
      "situation": "All four at the kitchen. Their righty plays their right side and their lefty plays their left, so both backhands meet in the middle.",
      "cue": "Their paddles are on the outside and the gap between them is backhand to backhand.",
      "action": "Send attackable balls low through the middle rather than to either sideline.",
      "why": null,
      "conditions": [],
      "common_mistakes": [
        "Aiming at a sideline because it looks open"
      ],
      "sources": [
        {
          "kind": "show_notes",
          "show_id": "402p",
          "episode_title": "Episode 66 (stacking discussion)",
          "note": "Paraphrased from the public episode description. Not yet checked against the transcript or attributed to a speaker."
        }
      ],
      "priority": 1.0,
      "distractor_candidates": [
        {
          "text": "At the lefty's outside hip",
          "origin": "plausible_alternative"
        }
      ],
      "tension_with": [],
      "claude_note": "Common reasoning, not yet verified against the episode: backhands meet at the seam, the net is lowest in the middle, and a middle ball can make both players hesitate."
    },
    {
      "id": "p-floater-attack-middle",
      "schema_version": 1,
      "sample": true,
      "status": "active",
      "category": "strategy",
      "topic": "speed_up",
      "format": "doubles",
      "levels": [
        "4.0",
        "4.5"
      ],
      "statement": "Pounce on floaters with a short backswing and aim for the safe middle, not the line.",
      "situation": "A ball floats up above net height within reach at the kitchen.",
      "cue": "The ball is well above the net tape and still rising or flat as it reaches you.",
      "action": "Step in and take it early, keep the backswing short with the paddle out front, and hit through the middle.",
      "why": null,
      "conditions": [
        "The ball is above net height at contact"
      ],
      "common_mistakes": [
        "Letting a floater bounce when you could finish it",
        "Taking a big backswing"
      ],
      "sources": [
        {
          "kind": "show_notes",
          "show_id": "402p",
          "episode_title": "Episode 67 (floaters)",
          "note": "Paraphrased from the public episode description. Not yet checked against the transcript or attributed to a speaker."
        }
      ],
      "priority": 1.0,
      "distractor_candidates": [
        {
          "text": "Let it bounce so you can take a full swing",
          "origin": "named_mistake"
        }
      ],
      "tension_with": [],
      "claude_note": null
    },
    {
      "id": "p-below-net-reset",
      "schema_version": 1,
      "sample": true,
      "status": "active",
      "category": "strategy",
      "topic": "reset",
      "format": "doubles",
      "levels": [
        "4.0"
      ],
      "statement": "If you would contact the ball below net height, keep it soft instead of speeding it up.",
      "situation": "A dink or drop is dropping below the net tape as it reaches you.",
      "cue": "At contact the ball would be below the height of the net.",
      "action": "Reset or dink it back into their kitchen and wait for a ball you can attack.",
      "why": "Contact below the net means hitting up, which gives the opponents a ball to attack.",
      "conditions": [],
      "common_mistakes": [
        "Speeding up a ball from below the net"
      ],
      "sources": [
        {
          "kind": "illustrative",
          "note": "Development sample written by Claude to exercise the app. Not extracted from any episode."
        }
      ],
      "priority": 0.5,
      "distractor_candidates": [],
      "tension_with": [],
      "claude_note": null
    },
    {
      "id": "p-drop-and-advance",
      "schema_version": 1,
      "sample": true,
      "status": "active",
      "category": "drill",
      "topic": "transition",
      "format": "doubles",
      "levels": [
        "4.0"
      ],
      "statement": "Drill the drop-and-advance until you can reach the kitchen without popping a ball up.",
      "situation": "Practice session with a partner feeding from the kitchen.",
      "cue": null,
      "action": "Hit a drop from the baseline, move forward, split-step as the feeder contacts, reset, and repeat until you reach the kitchen.",
      "why": null,
      "conditions": [],
      "common_mistakes": [
        "Running through the split step"
      ],
      "sources": [
        {
          "kind": "illustrative",
          "note": "Development sample written by Claude to exercise the app. Not extracted from any episode."
        }
      ],
      "priority": 0.5,
      "distractor_candidates": [],
      "tension_with": [],
      "claude_note": null
    }
  ],
  "scenes": [
    {
      "id": "s-floater-backhands",
      "schema_version": 1,
      "sample": true,
      "format": "doubles",
      "players": [
        {
          "id": "you",
          "team": "us",
          "x": 5,
          "y": 13.9,
          "hand": "R"
        },
        {
          "id": "partner",
          "team": "us",
          "x": 15,
          "y": 13.9,
          "hand": "R"
        },
        {
          "id": "opp1",
          "team": "them",
          "x": 5,
          "y": 30.1,
          "hand": "R"
        },
        {
          "id": "opp2",
          "team": "them",
          "x": 15,
          "y": 30.1,
          "hand": "L"
        }
      ],
      "ball": {
        "from": {
          "x": 4.8,
          "y": 28.6,
          "z_in": 22
        },
        "now": {
          "x": 6.0,
          "y": 16.6,
          "z_in": 43
        },
        "net_clearance_in": 37,
        "hitter_id": "opp1",
        "shot_type": "floater"
      },
      "camera": {
        "eyes_of": "you",
        "mode": "over_shoulder"
      },
      "answer_overlay": {
        "target": {
          "x": 10,
          "y": 30.5,
          "rx_ft": 2.4,
          "ry_ft": 1.4
        },
        "shot": {
          "from": "ball",
          "to": {
            "x": 10,
            "y": 30.2,
            "z_in": 14
          },
          "net_clearance_in": 6
        }
      },
      "inferred": true,
      "inferred_fields": [
        "players",
        "ball"
      ],
      "notes": "All four at the kitchen. Their righty on your left, lefty on your right: both backhands in the middle."
    },
    {
      "id": "s-dropping-dink",
      "schema_version": 1,
      "sample": true,
      "format": "doubles",
      "players": [
        {
          "id": "you",
          "team": "us",
          "x": 5,
          "y": 13.9,
          "hand": "R"
        },
        {
          "id": "partner",
          "team": "us",
          "x": 15,
          "y": 13.9,
          "hand": "R"
        },
        {
          "id": "opp1",
          "team": "them",
          "x": 5,
          "y": 30.1,
          "hand": "R"
        },
        {
          "id": "opp2",
          "team": "them",
          "x": 15,
          "y": 30.1,
          "hand": "L"
        }
      ],
      "ball": {
        "from": {
          "x": 4.8,
          "y": 28.6,
          "z_in": 14
        },
        "now": {
          "x": 5.6,
          "y": 16.2,
          "z_in": 12
        },
        "net_clearance_in": 4,
        "hitter_id": "opp1",
        "shot_type": "dink"
      },
      "camera": {
        "eyes_of": "you",
        "mode": "over_shoulder"
      },
      "answer_overlay": {
        "target": {
          "x": 5.4,
          "y": 25.6,
          "rx_ft": 1.8,
          "ry_ft": 1.3
        },
        "shot": {
          "from": "ball",
          "to": {
            "x": 5.3,
            "y": 25.8,
            "z_in": 0
          },
          "net_clearance_in": 3
        }
      },
      "inferred": true,
      "inferred_fields": [
        "players",
        "ball"
      ],
      "notes": "A good dink that barely clears and is dropping below net height as it reaches you."
    },
    {
      "id": "s-occlusion-floater",
      "schema_version": 1,
      "sample": true,
      "format": "doubles",
      "players": [
        {
          "id": "you",
          "team": "us",
          "x": 5,
          "y": 13.9,
          "hand": "R"
        },
        {
          "id": "partner",
          "team": "us",
          "x": 15,
          "y": 13.9,
          "hand": "R"
        },
        {
          "id": "opp1",
          "team": "them",
          "x": 5,
          "y": 30.1,
          "hand": "R"
        },
        {
          "id": "opp2",
          "team": "them",
          "x": 15,
          "y": 30.1,
          "hand": "L"
        }
      ],
      "ball": {
        "from": {
          "x": 4.7,
          "y": 28.6,
          "z_in": 20
        },
        "now": {
          "x": 6.0,
          "y": 16.6,
          "z_in": 43
        },
        "net_clearance_in": 37,
        "hitter_id": "opp1",
        "shot_type": "floater"
      },
      "camera": {
        "eyes_of": "you",
        "mode": "over_shoulder"
      },
      "answer_overlay": {
        "target": {
          "x": 10,
          "y": 30.5,
          "rx_ft": 2.4,
          "ry_ft": 1.4
        },
        "shot": {
          "from": "ball",
          "to": {
            "x": 10,
            "y": 30.2,
            "z_in": 14
          },
          "net_clearance_in": 6
        }
      },
      "timeline": {